{
  "name": "k8s-pack",
  "version": "1.0.0",
  "description": "Kubernetes operations pack for AI Prompt System - deployment, debugging, and management",
  "tier": 3,
  "author": "AI Prompt System",
  "mcp_requires": ["kubectl-mcp", "helm-mcp"],
  "prompts": [
    "promt-k8s-deploy-rollout.md",
    "promt-k8s-pod-debug.md",
    "promt-k8s-helm-upgrade.md",
    "promt-k8s-service-mesh.md",
    "promt-k8s-storage-management.md"
  ],
  "triggers": {
    "деплой, deploy, rollout": "promt-k8s-deploy-rollout.md",
    "debug, crashloop, pod": "promt-k8s-pod-debug.md",
    "helm, upgrade, rollback": "promt-k8s-helm-upgrade.md",
    "service mesh, istio": "promt-k8s-service-mesh.md",
    "storage, pvc, volume": "promt-k8s-storage-management.md"
  },
  "dependencies": [],
  "tags": ["kubernetes", "k8s", "deployment", "helm", "devops"],
  "created_at": "2026-03-19"
}
