{
  "name": "ci-cd-pack",
  "version": "1.0.0",
  "description": "CI/CD pipeline pack for GitHub Actions, GitLab CI, and other platforms",
  "tier": 3,
  "author": "AI Prompt System",
  "mcp_requires": [],
  "prompts": [
    "promt-ci-github-actions.md",
    "promt-ci-gitlab-ci.md",
    "promt-ci-docker-build.md",
    "promt-ci-security-scan.md"
  ],
  "triggers": {
    "ci, ci-cd, pipeline": "promt-ci-github-actions.md",
    "github actions, workflow": "promt-ci-github-actions.md",
    "gitlab, gitlab-ci": "promt-ci-gitlab-ci.md",
    "docker, build, image": "promt-ci-docker-build.md",
    "security, scan, trivy": "promt-ci-security-scan.md"
  },
  "dependencies": [],
  "tags": ["ci-cd", "github-actions", "gitlab", "docker", "devops"],
  "created_at": "2026-03-19"
}
